A1: {MEMBER_NAME}
A2: {TOPMENU}

A1: New Benchmarking Services

A1: Step 1 Start Benchmarking | B1: Step 2 Confirm Benchmarking | C1: Step 3 Save to My History

A3: Balance Sheet For the period ended
A4: ASSETS | C4: Rating | D4: % | E4: Chart of Account (Codes)
B5: Liquidity
B6: Liquidity Reserves | C6: =SUM(C6:C7) -> 4744993 | D6: =SUM(C8/C37*100) -> 13.418802227179441
B8: Loan Delinquent (1-12 months)
B9: Total Loan Delinquent (1-12 months) | C9: =SUM(C14:C15) -> 6740518 | D9: =SUM(C16/C37*100) -> 19.062130955881941
B11: Loan Delinquent (> 12 months)
B12: Loans Receivable - Restructured | C12: =SUM(C19:C20) -> 0 | D12: =SUM(C21/C52*100) -> 0
B13: Loans Receivable- Past Due for 1-12 months | C13: =SUM(C19:C20) -> 0 | D13: =SUM(C21/C52*100) -> 0
B14: Loan Delinquent (>12 months) | C14: =SUM(C19:C20) -> 0 | D14: =SUM(C21/C52*100) -> 0
B15: Loans Receivable - Past Due for >12 months | C15: =SUM(C16+C21) -> 6740518 | D15: {P19}
B16: Loans Receivable-Loans in Litigation | C16: =SUM(C16+C21) -> 6740518 | D16: {P20}
B17: Total Loan Delinquent (>12 months) | C17: =SUM(C16+C21) -> 6740518 | D17: {P21}
B18: Total Loan Delinquency | C18: =SUM(C16+C21) -> 6740518 | D18: {P22}
B19: Total Loan Portfolio | C19: =SUM(C11+C22) -> 25023991 | D19: =SUM(C23/C37*100) -> 70.767646267068955
B21: Allowance for Probable Losses on Loans
B22: Total Provision for Doubtful Loans | C22: =SUM(C26:C27) -> 1422659 | D22: =SUM(C28/C37*100) -> 4.0232682656680163
B23: Net Loans Outstanding | C23: =SUM(C23-C28) -> 23601332 | D23: =SUM(C29/C37*100) -> 66.744378001400932
B25: Investments:
B26: Total Investments | C26: =SUM(C32:C33) -> 502502 | D26: =SUM(C34/C37*100) -> 1.4210716341967466
B27: Total Assets | C27: =SUM(C8+C29+C34+C35) -> 35360779 | D27: =SUM(C37/C37*100) -> 100
A29: LIABILITIES
B30: Savings Deposits | C30: =SUM(C41:C42) -> 2608431 | D30: =SUM(C43/C56*100) -> 7.376621991274571
B31: Non-Interest Bearing Liabilities & Short Term Payables | C31: =SUM(C41:C42) -> 2608431 | D31: =SUM(C43/C56*100) -> 7.376621991274571
B32: Non-Interest Bearing Liabilities -Non Short-Term Payables | C32: =SUM(C41:C42) -> 2608431 | D32: =SUM(C43/C56*100) -> 7.376621991274571
B33: Total Non-Interest Bearing Liabilities | C33: =SUM(C41:C42) -> 2608431 | D33: =SUM(C43/C56*100) -> 7.376621991274571
B35: External Credit | D35: =SUM(C45/C56*100) -> {P45}
B36: Total External Credit | C36: =SUM(C46:C47) -> 0 | D36: =SUM(C48/C56*100) -> {P48}
B37: Total Liabilities | C37: =SUM(C40+C43+C48) -> 29418419 | D37: =SUM(C49/C56*100) -> 83.195053480015247
A39: EQUITY
B40: Member Share Capital | C40: =SUM(C52:C54) -> 5942360 | D40: =SUM(C55/C56*100) -> 16.804946519984753
B41: Total Institutional Capital | C41: =SUM(C52:C54) -> 5942360 | D41: =SUM(C55/C56*100) -> 16.804946519984753
B42: Transitory Capital | C42: =SUM(C52:C54) -> 5942360 | D42: =SUM(C55/C56*100) -> 16.804946519984753
B43: Total Equity | C43: =SUM(C52:C54) -> 5942360 | D43: =SUM(C55/C56*100) -> 16.804946519984753
B44: Total Liabilities & Equities | C44: =SUM(C49+C55) -> 35360779 | D44: =SUM(C56/C56*100) -> {P56}
A45: INCOME STATEMENT for the months ended
A46: INCOME
B47: Net Loan Income | C47: =SUM(C63-C64) -> 3103253 | D47: =SUM(C65/C69)*100 -> 70.956198009044058
B48: Total Income | C48: =SUM(C65:C68) -> 4373477 | D48: =SUM(C69/C69 * 100) -> {P69}
A50: FINANCIAL COSTS
B51: Total Financial Costs excluding Interest Cost on Shares | C51: =SUM(C72:C73) -> 1174096 | D51: =SUM(C74/C69*100) -> 26.845825415338869
B52: Gross Income Margin | C52: =SUM(C69-C74) -> 3199381 | D52: =SUM(C75/C69*100) -> 73.154174584661121
A54: OPERATING EXPENSES
B55: Total Operating Expenses before Probable Loss on Delinquent Loans | C55: =SUM(C78:C82) -> 2888779 | D55: =SUM(C83/C69*100) -> 66.052228009887784
B56: Total Operating Expenses | C56: =SUM(C83:C84) -> 4311438 | D56: =SUM(C85/C69*100) -> 98.581471904390952
B57: NET INCOME before other Income/Expense | C57: =SUM(C75-C85) -> -1112057 | D57: =SUM(C86/C69*100) -> -25.427297319729821
B58: Net Income | C58: =SUM(C86:C87) -> -1112057 | D58: =SUM(C88/C69*100) -> -25.427297319729821
B60: Allocation of Net Income:
B61: Undivided Net Income | C61: -1112057
C62: -1112057
C63: -1112057